{
  "schema_version": 1,
  "attempt_id": "11111111-1111-4111-8111-111111111111",
  "sha": "aaaaaaaaaaaaaaaaaaaaaaaaaaaaaaaaaaaaaaaa",
  "creation_boot_id": "22222222-2222-4222-8222-222222222222",
  "recovery_boot_id": null,
  "inputs_sha256": "bbbbbbbbbbbbbbbbbbbbbbbbbbbbbbbbbbbbbbbbbbbbbbbbbbbbbbbbbbbbbbbb",
  "launcher_manifest_sha256": "cccccccccccccccccccccccccccccccccccccccccccccccccccccccccccccccc",
  "state": "prepared",
  "supervisor_pid": 2200,
  "supervisor_start_ticks": 6200,
  "cgroup_parent_path": "/sys/fs/cgroup/user.slice/clinic.scope",
  "cgroup_parent_device": 1,
  "cgroup_parent_inode": 100,
  "cgroup_path": null,
  "cgroup_device": null,
  "cgroup_inode": null,
  "controller_pid": null,
  "controller_pgid": null,
  "controller_start_ticks": null,
  "controller_barrier_released": null,
  "active_child_kind": null,
  "active_child_name": null,
  "active_child_pid": null,
  "active_child_pgid": null,
  "active_child_start_ticks": null,
  "active_child_barrier_released": null,
  "heartbeat_sequence": null,
  "heartbeat_at_utc": null,
  "publication_records": [],
  "started_at_utc": "2026-07-16T12:00:00.000000Z",
  "controller_ended_at_utc": null,
  "termination_kind": null,
  "boot_disappearance_sha256": null,
  "wait_exit_code": null,
  "wait_signal": null,
  "timed_out": false,
  "typed_outcome_sha256": null,
  "kill_domain_removal_kind": null,
  "kill_domain_removed_at_utc": null,
  "cleanup_verified": false,
  "updated_at_utc": "2026-07-16T12:00:00.000000Z"
}
